{"id": "va-1", "input": {"finding_id": "1001"}, "context_fixtures": {"asset": "internet-facing, prod", "exploit": "public"}, "expected": {"priority": "critical"}, "checks": [{"type": "json_schema", "schema": "schemas/triage-result.json"}, {"type": "field_equals", "path": "priority", "value": "critical"}], "rubric": ["Evidence supports the priority", "Owner is from the CMDB or null, never guessed"]}
